{
  "schemaVersion": "1.0",
  "scenario": "emi_only",
  "minecraftVersion": "1.21.11",
  "installedViewers": ["emi"],
  "adapterStates": [
    {
      "viewer": "jei",
      "version": null,
      "artifactKind": "none",
      "status": "not_installed"
    },
    {
      "viewer": "emi",
      "version": "fixture-1.21.11",
      "artifactKind": "test_fixture",
      "status": "fixture_only"
    }
  ],
  "selectedSource": "vanilla_client",
  "catalog": {
    "generationId": "Fixture-emi-only",
    "resources": [],
    "processes": []
  },
  "expected": {
    "startup": "degraded",
    "fallbackAvailable": true,
    "duplicateProcesses": false
  }
}
